### ISSUE TITLE
Filtering of COAP messages which hop via another thread router

### ISSUE THREAD

**Issue by kentsimp** [eclipse/californium#1760]
We have a COAP open thread network consisting of end devices (nodes) and routers. 

We use Californium to receive login messages from the nodes via multicast. 

When the nodes are placed further away from the master, they use the thread network to route messages via another node and when this happens we can see the messages arriving at the linux OS (in tcp dump), but they seem to be filtered out from being presented via californium to my multicast endpoint.

We are currently on Californium version **3.0.0-M4**

```
Here is a Child missing Login Request

13:51:38.797963 IP6 fdde:ad00::7655:b9f0:8d91:1cd4.5683 > ff03::1.5683: UDP, length 44
        0x0000:  6000 0000 0034 1140 fdde ad00 0000 0000  `....4.@........
        0x0010:  7655 b9f0 8d91 1cd4 ff03 0000 0000 0000  vU..............
        0x0020:  0000 0000 0000 0001 1633 1633 0034 c6b2  .........3.3.4..
        0x0030:  4202 2dc8 614e b56c 6f67 6f6e ff72 6562  B.-.aN.logon.reb
        0x0040:  6f6f 743d 3126 6575 6936 343d 3930 4644  oot=1&eui64=90FD
        0x0050:  3946 4646 4645 3742 3546 3532            9FFFFE7B5F52
```

```
Here is a Router good Logon Request and response
14:00:44.360226 IP6 fdde:ad00::7695:70cf:a63a:895a.5683 > ff03::1.5683: UDP, length 44
        0x0000:  6000 0000 0034 1140 fdde ad00 0000 0000  `....4.@........
        0x0010:  7695 70cf a63a 895a ff03 0000 0000 0000  v.p..:.Z........
        0x0020:  0000 0000 0000 0001 1633 1633 0034 da1e  .........3.3.4..
        0x0030:  4202 8e69 69e7 b56c 6f67 6f6e ff72 6562  B..ii..logon.reb
        0x0040:  6f6f 743d 3126 6575 6936 343d 4430 4346  oot=1&eui64=D0CF
        0x0050:  3545 4646 4645 3837 3445 3738            5EFFFE874E78
14:00:44.366447 IP6 Khadas.5683 > fdde:ad00::7695:70cf:a63a:895a.5683: UDP, length 6
        0x0000:  6000 36ac 000e 1140 fdde ad00 0000 0000  `.6....@........
        0x0010:  daf2 97e7 1979 cace fdde ad00 0000 0000  .....y..........
        0x0020:  7695 70cf a63a 895a 1633 1633 000e b4fc  v.p..:.Z.3.3....
        0x0030:  6243 8e69 69e7                           bC.ii.
```

**Some observations:**
- The Border Router and WPCS Router share common MLEID up to `fdde:ad00:0000`
- Whereas the Child WPCS only shares MLEID up to `fdde:ad00`

Below is my code which initialises the multicast server. I have read some issues/answers about linux filtering and using the "any" address, but this is a little beyond my understanding of multicast and californium. Hoping there is a simple fix to my configuration settings 🤞 

```
	private boolean createEndpoints(final CoapServer server, final int multicastPort, final NetworkConfig config) throws SocketException, UnknownHostException {

		final NetworkInterface networkInterface = NetworkInterfaceUtil.getMulticastInterface();
		if (networkInterface == null) {
			LOGGER.warn("No multicast network-interface found!");
			return false;
		}
		LOGGER.info("Multicast Network Interface: {}", networkInterface.getDisplayName());

		if (NetworkInterfaceUtil.isAnyIpv6()) {
			// below gets the MLEID ipv6 address from the network adapter
			final Optional<Inet6Address> meshAddress = NetworkInterfaceUtil.getMeshAddress();
			if (!meshAddress.isPresent()) {
				LOGGER.info("No mesh address available");
				return false;
			}

			final UDPConnector udpConnector = new UDPConnector(new InetSocketAddress(meshAddress.get(), multicastPort));
			udpConnector.setReuseAddress(true);
			final CoapEndpoint coapEndpoint = new CoapEndpoint.Builder()
					.setNetworkConfig(config)
					.setConnector(udpConnector)
					.build();

			final InetAddress address = new InetSocketAddress("[ff03::1%wpan0]", 0).getAddress();

			final UdpMulticastConnector.Builder builder = new UdpMulticastConnector.Builder()
					.setLocalAddress(address, multicastPort)
//					.setOutgoingMulticastInterface(address)
					.addMulticastGroup(address, networkInterface);

			createReceiver(builder, udpConnector);

			server.addEndpoint(coapEndpoint);
		}

		final UDPConnector udpConnector = new UDPConnector(new InetSocketAddress(InetAddress.getLoopbackAddress(), multicastPort));
		udpConnector.setReuseAddress(true);

		final CoapEndpoint coapEndpoint = new CoapEndpoint.Builder()
				.setNetworkConfig(config)
				.setConnector(udpConnector)
				.build();

		server.addEndpoint(coapEndpoint);

		LOGGER.info("Multicast Server (IPv6) started");

		return true;
	}
```

Thanks for your help.

**Comment by boaks** [comment]
Let me try to give an answer:

My experience with multicast is not that smooth. In the very most cases, the story starts at the OS and ends in the java environment; if you know, how to "setup" a plain-java `MulticastSocket` (without using Californium) proper for your use-case on your OS, we can extend the `UdpMulticastConnector` to able to apply that "setup".

But I'm not able to spend time into reproduce that issue and analyze how to sort it out.

**Comment by boaks** [comment]
Thanks for your feedback.

And, sure, there will be other releases after the 3.0.0-RC1.
So, if you have an outcome, just report it. I really appreciate, that you use open thread and care, that it works with Californium!
